{
  "schemaVersion": "1.0",
  "id": "starter-bundle",
  "version": "1.2.0",
  "title": "A packet with several modules",
  "modules": [
    {
      "id": "hello-module",
      "version": "1.0.0"
    },
    {
      "id": "full-module",
      "version": "2.1.0"
    },
    {
      "id": "extra-module",
      "version": "0.3.0"
    }
  ]
}
